Senti score,Original Tag,Original text,Senti words
Positive,Positive,"Wonderful. The location is excellent, close to all amenities, quiet staff, and a special thanks to the receptionist, companion for professionalism in handling and good reception.
",location excellent close quiet staff special thanks receptionist companion professionalism good reception
Positive,Positive,"Taste the taste of the grill and enjoy the experience. A friend said to me about his experience in tasting their food, which attracted me to try it. When I went to it, I had difficulty finding a position because of the zahk. I stood in line and bought four types of rice that he had in addition to the chicken grill. And he reminded me of pick-up flavors, the taste for rice is frankly all similar to the flavor of the spice is overwhelming and this means no distinctive taste the chicken is well roasted and spices maggie one of its components that are placed inside the chicken gives a new flavor to the grill chicken and is the same mixture that the West puts inside the turkey the cause of the noise and Fame is that it is by style restaurants For fast food in the demand mode and queue numbers
",taste grill enjoy experience friend experience tasting food try difficulty position line rice addition chicken grill pickup taste rice frankly similar flavor spice means distinctive taste chicken well maggie inside chicken new flavor grill chicken mixture inside turkey cause noise style fast food demand mode queue
Positive,Positive,"I finished reading it two days ago ... I remember that I could not close the book and my tears did not spill .. not because it is new .. The most painful thing about a new wound is when a writer brilliantly exudes what you keep between the corners of your memory .. that story .. These events .. The amount of life and pain all passed through me according to the names and location .. Amazing How are our stories similar to the extent of the match .. Ghassan managed to convey that image .. and still .. awesome
",finished reading two ago remember close book spill new painful new wound writer brilliantly keep memory story amount life pain according location similar extent match convey image still awesome
Positive,Positive,"A wonderful book for Fahmy Howeidi. A book that responds and refutes the claims of the laymen, four Egyptian writers. And their allegations that the application of Sharia is not appropriate. I liked his style and his way of explaining to the reader their lies, slander and ridiculous arguments. Worth reading
",wonderful book book application appropriate liked style way reader slander ridiculous reading
Positive,Positive,"good. The staff is very helpful and the cleanliness is calm suitable for families and close to restaurants and supermarkets. The internet is slow, the parking is very narrow and the pool is bad
",good staff helpful cleanliness calm suitable close internet slow narrow pool bad
Positive,Positive,"good. Health club breakfast. There is an unpleasant smell in the bathroom
",good club breakfast unpleasant smell bathroom
Positive,Positive,"No wonder the writer of the novel committed suicide, a novel with pages of intense psychological struggle that makes you think about suicide. As soon as I read it for a few hours, I felt a severe numbness, so how was the psyche of its writer
",wonder writer novel suicide novel intense psychological struggle think suicide soon read hours severe numbness psyche writer
Positive,Positive,"Ideology is like water and air. O Muslim, I know and know your faith, may God have mercy on our blond Sheikh
",water air know know faith mercy blond
Positive,Positive,"Ahmed Al Shugairi is a person whose words are not enough for me to express the feelings of goodness, peace, mercy and goodness within me. This introduction came to classify the thought that I can talk about when I talk about something that he has supervised as a writer or regarding his thoughts .. A beautiful book differs somewhat in its content The book is divided into two parts The first section, which talks about Ahmed Al Shugairi&#39;s trip to India and the second section which In it he tells us about his journey with Gandhi, the most important and greatest of the things that he took his way to tell us about the genius Gandhi. In general, the book is very beautiful in its idea and it contains some real information, which clearly wrote utterly to solve some societal issues. I did not content myself with the first section and I wanted to extend the trip to get to know India more, which will motivate me to visit India.
",person enough express goodness peace mercy goodness within introduction classify thought talk talk writer beautiful book somewhat content book two first section trip second section journey important greatest way tell genius general book beautiful idea real information clearly utterly solve societal content first section wanted extend trip get know motivate visit
Positive,Positive,"good. New, very clean, good location for the campus. Very bad service until I transport the bags. I did it myself, even the number of beds in the rooms. For the third time, I imagine I am a mahram, sending a cleaner to the room, and we find a family. Finally, after a complete roll on the fourth floor, there is no TV. Workers say the dish is not installed. There is no villa. There is no restaurant. There is no parking, knowing that I chose during reservation a free parking.
",good clean good location campus bad service transport number third time imagine sending cleaner room find family complete roll fourth floor say dish villa restaurant knowing reservation free
Positive,Positive,"Great hotel and respectful of customers. Everything I liked about the hotel is the staff is very friendly, respectful and respectful of the guest. The mattress is very rough, the pillows didn&#39;t work for me, it might suit me
",respectful liked staff friendly respectful respectful guest mattress rough work suit
Positive,Positive,"Dubai&#39;s finest hotels. Everything I liked: The location of the hotel overlooks the sea and is wonderful..General services and room services are fast..Planning the hotel community more than beautiful..Respection personnel were a summit in magnificence, especially Professor Ahmed..Egyptian nationality .. I advise everyone to deal with them I spent the most beautiful days In this hotel as most of my photos in Dubai are pictures of antiques, swimming pools and restaurants of the hotel .... nothing
",finest liked location room community personnel summit magnificence nationality advise everyone deal beautiful swimming nothing
Positive,Positive,"A mixture of history, sociology and psychology with an ironic style and objective methodology
",mixture history sociology psychology ironic style objective methodology
Positive,Positive,"Excellent . Everything is perfect. The price is expensive two pills
",perfect price expensive two
Positive,Positive,"A really interesting book ... Ben Nabi, the teacher, accompanies you in the details of his life
",really interesting book teacher life
Positive,Positive,"I ruined this novel, oh God, hahahahahahahaha. Firstly, the novel is more than wonderful. Its idea is very strong and real. It will be a reason, so many people change, and I am the first of them. God willing, in your company in paradise ... but I wanted to say, I also need something, at the beginning, I wanted to complete the novel for the other because I liked it, but the way the story was narrated was not interesting enough enough, I was thinking of complementary because of this, but thank God I completed it for the end because its end is a masterpiece Hard and has a strong message, I may not be able to hold myself It is laughter about the unexpected end, but it is a real bigger greeting to you, you are a talented writer, and good luck, God willing, in the upcoming works.
",novel oh novel wonderful idea strong real reason many people change first willing company paradise wanted say need beginning wanted complete novel liked way story interesting enough enough thinking complementary thank completed masterpiece strong message able hold laughter unexpected real bigger greeting talented writer good luck willing upcoming
Positive,Positive,"Thanks to the staff and for the reception. The location and services of the smiling staff. There is no
",staff reception location staff
Positive,Positive,"good. . Wi-Fi is not free, while in less apartments it is free
",good free less free
Positive,Positive,"Exceptional. A new hotel and another new area in Dubai It seems that this hotel will be among the prestigious hotels in Dubai as it chooses the staff carefully.
",new new prestigious staff carefully
Positive,Positive,"The novel is excellent, and its style is completely new to it, from the most beautiful novels. Elly, her village after Azazel. A short sentence, but it is expressive and extremely beautiful. I still remember some of her sentences. Eazinb, and I keep writing to you, you start imposing your presence. On a faded entity, he continues to do me a drink, giving him a chance to show off. Love is the state of Alana&#39;s identification with the other. Yazinab never absent and present in the conscience. I am the one here I am not who I was. Sadness, human beings varied from resident and from transit. Optimism is a great risk for my likes. Her face took her astonishment. It is hard for one to live without losing his reasons for being alive. Unaware, I am the extent of irresponsibility, or foolish, the extent of stupidity
",novel excellent style completely new beautiful village short sentence expressive extremely beautiful still remember keep writing start imposing presence faded entity continues drink giving chance show state identification absent present conscience human varied resident transit great risk astonishment hard live without alive extent irresponsibility foolish extent stupidity
Positive,Positive,"A wonderful...
",wonderful
Positive,Positive,"With confidence, the best novel published in so far.
",confidence best novel far
Positive,Positive,"Wonderful. everything. Booked a smoker room and not available
",everything smoker room available
Positive,Positive,"Razavi Ashour completed the journey of creativity .. This is something that is full of words .. I loved very dearly and lived with her every moment. . There is only one mistake. At night, there is no description of Razavi originally. May God have mercy on you, Razavi
",completed journey creativity full loved every moment mistake night description mercy
Positive,Positive,"I have another experience. Excellent cleanliness. The services are far
",experience cleanliness far
Positive,Positive,"Excellent . everything. No free Wi-Fi in the rooms
",everything free
Positive,Positive,"My dream was that the worry would go away from me. At your door. It was my dream to see my grave. On your doorstep. I hinted as a technician and it was a wave. More merciful than your torment And I spared my homeland, a grave containing me in your soil. So I was confused with housing. And now hold back the shroud. What happened to you, my country? . I screamed and the words run from my mouth: these are countries ... they are not my country anymore
",dream worry go away dream see grave doorstep technician wave merciful torment homeland grave soil confused hold back country run mouth country anymore
Positive,Positive,"A beautiful book, I love the simplicity of Ahmed El-Aidy, who is strong and has more than one masterpiece poem, such as: Thanks God. Jerk off to innocent desire. To check me. Orphan Paragraph. Small cut. The last one loves you. Why do I like it so much? Of course it is not possible for this masterpiece. I don&#39;t know when I stayed like this. Not possible. He does not love girls. Other than those who love pain. My chest is open to air. But I ... locked. What are you doing doctor? In what blindness hope. Even what I understood via it. Complementary. A railway that can be reposted. Do not forget. I have to run the tears. With cheap laughter. And always shy ... I don&#39;t know when I stayed like this. Not possible. I missed you, I found myself pocketing your name and pressing.
",beautiful book love simplicity strong masterpiece poem innocent desire check cut last much course possible masterpiece know possible love love pain chest open air doctor blindness hope via railway forget run cheap laughter shy know possible missed
Positive,Positive,"Most people judge books based on the cover, which is common. As for others like me, I judge him from the beginning of his pages; the writing style is what makes me keep reading .. In this novel specifically, I read the first of its pages and felt like a continuation of another book, as the writer started to tell the story as if the reader knows what he is talking about .. I stopped reading I put the book aside, I was very surprised when I got this high evaluation? It is true that people&#39;s tastes differ, but everyone who asks and reads from him finds him praising him and saying, keep reading, it&#39;s wonderful. I didn&#39;t give them any attention, and I read several other books, but destiny wanted me to think about it, and I found a colleague of mine who encouraged me to read it with me .. I started and deepened, and I signed this book from those books that you find yourself thinking about and wondering about, I felt that I was actually with them , I felt the sadness that they feel, with joy, of resentment, and even of the taste of the pies they eat .. I lived with them their joy and their sorrow, and what more sadness. The novel begins with the grandfather and ends with the grandson of the granddaughter. You can imagine how many of the situations I lived with them ... I created Radwa Ashour in them, and I will definitely read everything I wrote, God willing.
",people judge cover common others judge beginning writing style keep reading novel specifically read first continuation book writer tell story reader talking reading put book aside surprised high evaluation true differ everyone praising keep reading wonderful give attention read several destiny wanted think colleague encouraged read book find thinking actually sadness feel joy resentment taste eat joy sorrow sadness novel grandfather grandson granddaughter imagine many definitely read everything willing
Positive,Positive,"We speak when the gates of peace are closed to us before our thoughts, and when we are unable to reach the state of stillness in the unity of our hearts, we turn to seize our lips, because the sound distracts us and entertains us, and in many of our words our thoughts almost explode from pain and gloom, because thought is a bird from space birds, which can simplify His wings are in the cage of words, but he cannot fly.
",speak peace unable reach state stillness unity turn seize sound many explode pain gloom thought bird space simplify cage fly
Positive,Positive,"Wonderful. The location is excellent, and the breakfast buffet is great. The internet was weak
",location excellent breakfast buffet great internet weak
Positive,Positive,"New frontiers of historical information river
",historical information river
Positive,Positive,"A beautiful novel, much more beautiful than the series ... The beginnings of Ahmed Murad
",beautiful novel much beautiful series
Positive,Positive,"The comment of my older brother, Dr. Mohamed Ibrahim, on the book. : //. . / / .... A very important book, and I recommend reading it strongly. Especially for those who count themselves among the youth of the Islamic trend.
",comment older brother book important book recommend reading strongly count youth trend
Positive,Positive,"W Barcelona offers residential services I stayed at the W Barcelona from day to day, in a great room. I arrived early and registered my name at the hotel. The registration process is always busy, and there is a big and happy surprise but with mixed feelings. Sometimes your early arrival leads you to a room that no one else wants. My share of room number, was on the fifth floor. The beach was opposite my room, but a third of the view was obstructing me due to the other prominent rooms at the front. This only affects the first floors, so be careful, as each room ends with a number that has the same problem. These rooms are also adjacent to the storage and laundry rooms, among others. I loved the design of the room, the shared desk with the bed is very soft, what a really good bed spoil me, as well as the spacious space. The shower space can accommodate five people, not joking, so let’s consider, for example, that you took your boyfriend to have sex for the first time. You will inevitably discover the peculiarities of their bathroom laughing out loud. I did not consume anything from the room fridge, as there is a big store and restaurants at the beginning of the beach, and this is a pleasant walk away. Prices for the pool area and services are very moderate. On Sunday, on the top floor, you do not stop by the pool, the staff working in this area did not check the area even once, so I did not receive any services. Another day, I learned that the top floor was open, and I went up. I learned that it was closed when I asked for a service. Then I learned that it is not closed, but there is no service. I was just meters away from the main bar. The position of the workers in this area is as if they say, I know, man, that we are very calm. We do a favor for you here. However, I left the area and did not return to it for the duration of my stay. Hint I use the signs; I can&#39;t read minds, but if the staff is so lazy that they can&#39;t do the services upstairs, there&#39;s something wrong. At the nightclub, I was disappointed again because of the lack of communication, and the lack of signs or information about the region&#39;s protocols. I saw every two sitting on your sofas, so I had to leave completely. If there were signs, there would be no embarrassment for the people. After eleven o&#39;clock in the evening this region becomes private and the cost of staying in euros is where the excellent service provided by the workers once the place is opened. It seems that those who provide alcoholic beverages are good, but when they are busy like this then there will be speed, yet my drink was moderate. Wave Restaurant I had a very good meal, and a great attentive service made me happy. Managers always work hard, but sometimes regret can be an easy backup. Guest services What about the low seating for guests? Sitting in this drop feels as if the seat is the one sitting on you, the opposite must be done, according to the known power arrangement. And we ended up changing rooms, on the number floor, room number, which is the same type of room as it overlooks a port, after I mentioned that the wonderful rooms are supposed to have nothing to obscure seeing from them. Note that the warm rooms are located on floors from to; these rooms seem to be great except for rooms from to; all overlook the ocean and the harbor. As for all the large rooms and others overlooking the beach and the city. Location I did not find the location far from the old neighborhoods, so you can walk on foot, or take the bus number / which stops on the main road near the hotel entrance, and the price of the bus ticket. Euros, and the taxi may cost you approximately Euros. Overall, I would probably come here again, as the location fits in with me, as is the layout of the room, the bathroom was excellent and the two rooms were reasonably quiet. It was a shame there was the low pool service as well as what is known as nerve cooling. As the title shows, this place caters to a specific demographic as it focuses on it well, but I am not a fashion fan, but all I want is comfort and kindness. It is a service.
",day day great room early registration process busy big happy surprise mixed early arrival room else share room number fifth floor beach opposite room third view due prominent front first careful room number problem adjacent storage laundry others loved design room desk bed soft really good bed spoil well spacious space shower space accommodate five people consider example boyfriend sex first time inevitably discover bathroom loud consume room fridge big store beginning beach pleasant walk away pool moderate top floor stop pool staff check receive day learned top floor open learned service learned service away main bar position say know calm favor left return duration stay use read staff lazy wrong nightclub disappointed lack communication lack information saw every two leave completely embarrassment people eleven region private cost excellent service place provide alcoholic good busy speed drink moderate good meal great attentive service happy work hard regret easy backup low drop seat opposite according power arrangement ended changing number floor room number type room port wonderful nothing obscure seeing warm great except overlook ocean harbor large others beach city find location far old walk foot bus number main road near entrance price bus ticket taxi cost approximately probably location room bathroom excellent two reasonably quiet shame low pool service well nerve cooling title place specific demographic well fashion fan comfort kindness service
Positive,Positive,"Weird this creative ability that transports you between the lives of five people in a period of one year in several times the country goes through on page
",creative ability five people period year several country page
Positive,Positive,"Ahmed Abdul Majeed. For the second time, it brings psychological peace to his followers
",second time psychological peace
Positive,Positive,"An important book I recommend reading it. But I think the name does not apply to the topic .... The book in general analyzes the Islamic-Islamic dispute from the point of view of sociology ... It is a new reading ... I very much enjoyed it ... His analysis of the temptation during the era of Uthman ... and Ali’s disorder and Muawiyah and the dispute Shi’ite Sunni, to say the least, is wonderful. His analysis of the revolutions and how success is the grave of the revolution .. And that a small organized group can defeat a large, dispersed group ..... And I conclude with a quote from the book ... The truth without strength supports it, there is no good in it
",important book recommend reading think apply book general dispute point view sociology new reading much analysis temptation disorder dispute say least wonderful analysis success grave revolution small organized group defeat large group conclude quote book truth without strength good
Positive,Positive,"Excellent. The location is very excellent, the price is reasonable and it has breakfast and internet. The internet is bad
",location excellent price reasonable breakfast internet internet bad
Positive,Positive,"My heart hurts ..... This novel exhausted me. Feeling of complete helplessness, I felt after a word in its last pages. How do I describe all this painful sadness .. How do I revive my words after she died with her people one by one. If death is the title of the novel..the language has a life..the language is rich and rich and empowered..what attracts you to its world, praising in its vastness, enjoying it with the limit of joy and the limit of love and pain. Ayman Al-Atoum .. my full respect and appreciation..and you are creative
",heart novel exhausted complete helplessness word last describe painful sadness revive people death title language lifethe language rich rich world praising limit joy limit love pain full respect creative
Positive,Positive,"The hotel deserves ... Roqan .... Location ... good handling ... cleanliness ... close to Mall of the Emirates ...
",good cleanliness close
Positive,Positive,"A simple and brief explanation of many religions. My favorite writer, Anis Mansour .... and I will sail in the world of Anis ..
",simple brief explanation many favorite writer sail world
Positive,Positive,"I was one of the lucky ones to see a draft of that novel. So my testimony will be hurt. Regardless of my witness to the labor period, the author is one of the closest to my heart on a personal level. So I will try to summarize. Adoration is the next novel for a peace hymn. If you like the hymn, you will love. Abdul Majeed has developed a lot of his style of narration and has started to move from event to smooth event. In a passion he entered into the convolutions of the soul more, so he made clear the difference between the human qualities that make man from a person who does not rise to the quality of angels and does not descend from the characteristics of demons. In love you will understand more about the Igo .. The Igo that prevents us from rising and without Ego will give us wings to fly in the sky. He also dealt with traffickers, the greatest of souls and most of them. I liked his new narration. Connecting the past to the present. Ahmed has been united by his hero, so he writes this time with his spirit. I will not speak more and I will let you read it voraciously. Buy it, it deserves
",lucky see draft novel testimony hurt witness labor period author closest heart personal level try summarize next novel peace hymn hymn love developed lot style narration move event smooth event passion soul clear difference human make person rise quality descend love understand rising without give fly sky greatest liked new narration past present hero time spirit speak let read
Negative,Positive,"I know for sure that I have never treated a human being as petty or despicable, except that this is a punishment for him on bad manners. The telly of the Akkad character.
",know sure treated human petty despicable except punishment bad character
