Senti score,Original Tag,Original text,Senti wordsPositive,Positive,"As usual every period, I went to the Jarir Bookstore to see the new books and acquire some of them, in renewal of thought, reason and soul as well. I immediately refrained from many books and refrained from acquiring many of them for several reasons that were established after many visits to these commercial libraries: What is permanently observed in it is the abundance of nausea and absurdity in the Arab cultural product, from publications and books. It is, in addition to its small and weak ratio compared to European and American countries, this little is dominated by aggregation, imitation, copying and banality .. The price of prices is not tolerated by the largest proportion of shoppers and even members of the class Medium compared to an average sized book is not worth all that high amount. The Internet has enriched many books such as encyclopedias, dictionaries, books of information and the like, there is no need to purchase these books and spend huge amounts of money on it, and there is something that sings them in electronic ways easier .. Having a long row of books awaiting reading in my library and my home, there is no need to multiply from other books, But just a simple renewal and additions here and there ... I finished a medium-length tour of the library with four books. I was surprised at the accountant that they were all inadvertently novels, although I do not care much about them, but I balance them with many other cultural and intellectual books .. I returned home I went to the ground and put the narrators around The four T and a computer open to technical materials, I imagined that the owners of these novels and those technical material are sitting around me in a unique episode as if most of them are dead cultural preparation session. Yahya Hakki and I were with his novel Qandil Umm Hashem ... With us Taha Hussein and his novel Al-Ayyam .. There is a neighborhood between the living and it is Amin Maalouf and his African novels Lyon. Then the late Naguib Mahfouz and some of his chatter over the Nile .. And to Qusay&#39;s corner there had been since Anis Mansour and his days came in the Akkad Salon, but I did not join him in that unique session. And me with him a bitter pause later. In a heterogeneous manner, Bill Gates and a lengthy technical material were with us, a study from me for one of the endless Microsoft technical certificates .. I was confused about where to start and what I commend and who I will triple to him but the opinion settled from the subconscious of the wonderful late Yahya Hakki and his unique Qandil or Hashem In which he made his reputation as a work of the most important works of the short or slightly long story in the twentieth century .. We are here talking about a story written since the forties of the last century and you have always heard about it and read a lot of praise and praise in the books and cultural and literary circulation circulated, and perhaps the most important of those singled out in criticism in That time with a wonderful article is Al Adi By the martyr Syed Qutb, may God have mercy on him, then added to his valuable book: Books and Characters. Until the beginning of this article, it will captivate you and inform you that a flood of praise will spell out this story and this fictional creativity. When Sayyid Qutb opens this article to:. Oh Yahya Hakki ... where are you, man ... I wish I had the executioner&#39;s whip, lazy creator. . Syed continues to list my talents and creativity and compare them to Timur and others .. When he mentions that my right is less productive compared to others, but it is distinguished by type, quality, and talent in this little .. As for Timur, for example, he writes, writes and writes, and he must come across a good thing in this much that he writes. I also remember what the late scholar Mahmoud Shaker Abu Fahr wrote in his valuable book, False and Asmar about that humble man who visited him one day for the first time in his house with a writer and then contacted him later asking him for permission to be his friend and to visit him continuously that was the humble man Adeeb Yahya My right, since they have become close friends since then, and some sources attribute the professorship to Shaker and the apprentice to my right to death, may God have mercy on her in the last decade of the twentieth century .. So all these introductions that I have read, heard and seen about Yahya Hakki and Qandil or Hashem made something inside of me Great about this writer and his production so maybe p Some think that I have made the issue of ruling on it, and it is an easy issue, and it has a look and a blurring upon it. However, really despite all that, I was missing a lot, many, and not the inspector like the informant and anyone who tasted the custom. Every wonderful description about Qandil or Hashem and the smoothness and aesthetics of the language and style of Yahya Hakki Al-Qasasi does not all enrich that description from the moments of his reading and taste. For the first time, I read a story on many of my reading of this literary genre with this wonderful language, the smoothness of words and the splendor of the method that penetrates into the souls of the soul and does its act, for when you read to revive my right and specifically Qandil or Hashem, it is as if you drink water, or sip honey with its ingenuity in language love and draw pictures with ease and elegance Verbal grace .. Qandeel Umm Hashem’s story revolves around that young Ismail, whose rate does not qualify him for admission to local Egyptian colleges, and his father decides to send him abroad in Britain in order to complete his studies and return to a doctor that the family is proud of despite the hardships of distance, separation and financial pressure on the family because of this only With distress .. that villager turns to another man in Britain who bites, befriends, breaks, and also succeeds in his studies and returns to an ophthalmologist, but he is a doctor who revolts against customs, traditions, sophistication, and amulets, defying and praising against the current trend to dare and carry his stick and smash a lamp Hashim, that lamp suspended over the shrine of the lady takes the poor from Its oil to treat their patients with all their diseases and offer gifts and gifts to him .. The result was that the simple people of the neighborhood revolted against him and beat him until he nearly died to be rescued by his former colleague, the guard of the mausoleum and his shepherd .. The young doctor then decides to treat his fiancée, the ruminants in her eyes with his modern form, in which he has recovered dozens in a Britain. But her condition gets worse day by day until she almost loses sight .. In the end the young man reaches the stage of reconciliation between his youth and his traditions and returns to visit the shrine .. The shrine of the lady is not dispensed with his modern treatment .. This is the story in short, which will not make you need to read it of course, but The last sentence, perhaps, summarizing the whole idea of the story, which is dealing with crises of interaction between East and West. Between the backward East that has just looked for the glamor of Western civilization. Between the sight of the West and the insight of the East. Between the mind of the first world, and the spirit of the third world. Between decades and centuries of eastern backwardness and delay, and recent years of superiority and terrible western scientific progress .. This was the preoccupation of intellectuals and writers of preoccupation in the half of the twentieth century with the era of colonialism and the end of its end, so people were three types :. A class that satisfied the West with its advantages and disadvantages and decided to merge with it and completely strip it of its identity .. It classified completely closed to itself and closed the windows with many arguments until those withered and died .. And an intermediate class between this and that closed the doors as it all opened the windows and received the new with its advantages and disadvantages ... Perhaps this last class It is what Yahya Hakki, may God have mercy on him, tried to display and address through the story of this rebellious and confused young man between his traditions and his society who was looking at him with contempt and disgust and then reconciled and appreciated after that after he realized that there is no mind for the West without a soul for the East .. Is this conflict over? I do not think so, and still we are witnessing many civilized traumas who first went to the homes of the West, its universities and institutes to send his speeches from there despising its societies, universities, students, and curricula ... not reconcilable neither with himself nor with his family repeating the same mistakes and negatives. May not benefit his community, even in the end, what he learned and studied. He benefited himself .. quotes. Yahya Hakki formulates and casts all of this with unparalleled linguistic creativity and intellectual creativity. Look at him describing Ismail&#39;s arrival in the steamboat to Alexandria after he finished his studies: Why did the ships deliberately make this reluctance to reach, and what was the fastest in separation? Anyone who takes refuge in the arboretum remains a captive of his life. He describes him as Britain and described his girlfriend Mary: The acquaintance has a collision between the two characters, which comes out victorious or loser, the acquaintance has a meeting, and the friendliness is up to the future. He who seeks the morals of angels is overcome by the morals of beasts. These eastern emotions are vicious and hated because they are impractical and unproductive, and if they are stripped of benefit, there remains nothing but their weakness and humiliation. Rather, these emotions have strength in secrecy, not in disclosure. And the human soul does not find its strength and then its happiness unless it separates from the masses and confronts them. As for integration, it is weak and resentful. Here, it describes the poor people, and perhaps it describes all the Arab peoples: What is the benefit of jihad in a country like Egypt and with a people like the Egyptians, who have lived in humiliation for centuries, so taste and taste it? This is an old people and returned to their childhood, if there was someone to lead them, they would have jumped to manhood again in one step. The road is familiar and glory is old, and memories remain. The lover does not measure or compare, and if the comparison is entered from the door and the love passes through the window, here he describes how Ismail reached the stage of conciliation and reconciliation with himself and his community: Where are you, O Light that I have been absent forever? Welcome to you, the blurring of my heart and eyes was gone. I now understood what was hidden from me .. There is no knowledge without faith. He stuck to his knowledge of his spirit and foundation, and left exaggeration in machines and means. He relied on God, then on his knowledge and hands, so God blessed his knowledge and hands. There is not everything in you and me ... there is beauty, secrets, fun and splendor. Al-Saeed is one of her feelings. Then you have to. Between the migration season and the jellyfish. Perhaps Yahya Hakki, son of that neighborhood, did not intend to return to bless those shrines and their oils, but he wanted to convey the idea of reconciling science with faith, the science of the West with the faith of the East, and ended it with a happy, bright ending .. Here comes to our minds the story of the migration season to the north by Tayeb Saleh. It deals with the same idea and revolves its contexts around the same topic and the same way with that young man leaving from the Sudanese village submerged to Britain to study literature to return after the same period of years in Qandil or Hashem and events continue .. but the end of the season
",usual every period see new acquire renewal thought reason soul well immediately many many several many commercial permanently abundance nausea absurdity cultural product addition small weak ratio little aggregation imitation banality price largest proportion class average book worth high amount enriched many information need purchase spend huge money sings electronic easier long row reading library home need multiply simple renewal finished library surprised accountant inadvertently much balance many cultural intellectual home ground put around computer open technical technical material around unique episode dead cultural preparation session novel novel neighborhood living late chatter corner join unique session bitter pause heterogeneous manner technical material study endless technical confused start commend triple opinion settled subconscious wonderful late unique reputation work important short slightly long story twentieth century talking story last century read lot praise praise cultural literary circulation important criticism time wonderful article martyr mercy valuable book beginning article captivate inform flood praise spell story fictional creativity article wish whip lazy creator continues list creativity compare others right less productive others distinguished type quality talent little example good much remember late scholar valuable book humble day first time house writer permission friend visit continuously humble right become close attribute professorship apprentice right death mercy last decade twentieth century read inside writer production maybe think easy look upon really despite missing lot many informant custom wonderful description smoothness aesthetics language style enrich description reading taste first time read story many reading literary genre wonderful language smoothness splendor method soul act read revive right specifically drink water sip honey ingenuity language love draw ease elegance grace story around young rate qualify admission local father send abroad order complete return doctor family proud despite distance separation financial pressure family distress villager doctor sophistication praising current trend dare carry stick smash lamp lamp shrine lady poor oil treat offer result simple people neighborhood beat colleague guard mausoleum shepherd young doctor treat modern form condition worse day day sight young stage reconciliation youth visit shrine shrine lady dispensed modern treatment story short make need read course last sentence whole idea story interaction backward glamor civilization sight insight mind first world spirit third world eastern backwardness delay recent superiority terrible western scientific progress preoccupation preoccupation half twentieth century colonialism people three class satisfied decided merge completely strip identity completely many withered intermediate class received new last class mercy tried display address story rebellious confused young society looking contempt disgust reconciled mind without soul conflict think still many first send despising curricula family benefit community learned unparalleled linguistic creativity intellectual creativity describing arrival finished deliberately make reluctance reach fastest separation refuge arboretum remains captive life described girlfriend acquaintance collision two victorious loser acquaintance meeting friendliness future overcome eastern vicious impractical unproductive benefit remains nothing weakness humiliation strength secrecy disclosure human soul find strength happiness integration weak resentful poor people benefit country people humiliation taste taste old people childhood lead manhood step road familiar glory old remain lover measure compare comparison love window stage conciliation reconciliation community absent forever heart hidden knowledge without faith stuck knowledge spirit foundation left exaggeration means knowledge blessed knowledge everything beauty fun splendor migration season jellyfish neighborhood intend return bless wanted convey idea science faith science faith ended happy bright ending story migration season north idea around way young village study literature return period continue season
Positive,Positive,"Who am I to comment on the fairies of Barghouti Hussein?
",comment
Positive,Positive,"in the name of ALLAH, the most mercifull. The book discusses in several chapters the important tools for reading any book and how one of us can come out with the most benefit from the book. For example, he talks about the types of reading and how to make a good judgment about the book before going into it. On the importance of reading to this nation and why we read at all? And much more. It somewhat ends with my work in the last chapter in history science.
",book several important reading book benefit book example reading make good judgment book going importance reading nation read much somewhat work last chapter history science
Positive,Positive,"The novel is really beautiful. But it has to be a second part
",novel really beautiful second part
Positive,Positive,"A wonderful novel with its interesting and tedious narration and distinguished it in terms of idea and content. Snake and what you realize what snake. Facts I would not have noticed without reading this much fun little book
",wonderful novel interesting tedious narration distinguished idea content realize snake without reading much fun little book
Positive,Positive,"Beautiful biography. I liked it too. And I hated America more. I liked his willpower
",biography liked liked willpower
Positive,Positive,"Do not blame me O people of blame. Your identity, God knows best. He who does not know the full moon does not know the hair. How adore this song? Greetings to full moon lovers. And another for my devotees. Here is a devotional feeling. : //. . / = .... Azouz Al-Muzaini.
",blame people blame identity best know full moon know hair adore song full moon devotional feeling
Positive,Positive,"good. . I did not like the bad bed blanket, however it is old and comfortable, and it needs a necessary change
",good bad bed blanket old comfortable necessary change
Positive,Positive,"Wonderful. The great cooperation from the reception staff, especially the receptionist, Mr. Ayman. Building operations next to the hotel
",great cooperation reception staff receptionist next
Positive,Positive,"I love the thought of this man, may God have mercy on him, wonderful in the market of arguments and evidence, and very interesting and logical
",love thought mercy wonderful market evidence interesting logical
Positive,Positive,"One of the few books that really touched me personally is a high-profile novel
",really personally novel
Positive,Positive,"Beautiful family resort. We liked the calmness of the resort and its family faces. I was only with my children, and I did not feel fear, and it contains various games and the level of people in it is sophisticated, even foreigners were mindful that in the pool are children and their going to the seashore to swim, and we settled in the vacation.
",family resort liked calmness resort family children feel fear various games level people sophisticated mindful pool children going seashore swim settled vacation
