Senti score,Original Tag,Original text,Senti wordsPositive,Positive,"Qushtumur second reading:. The first reading was in a microbus and I am returning after I bought Qeshmutr for 6 pounds in Mansoura. The story is not about the five friends. The narrator is a friend of a spectator who did not appear in his capacity as being satisfied with the transfer and commentary on the authority of Taher Al-Adri and Hamada Ibn Al-Thawat, who loves the thing and turns against it. ..And it is true that there is no more correct concept of happiness .. There is a reference to the book “The Return of the Sheikh that Al-Sabbagh brought to one of the characters of the novel.” This is what came to my mind where Professor Muhammad Abdul Nabi brought his novel The Return of the Sheikh. The last for the bitch and the storyteller. / Quoting from the narrator before we are guided to Qushtamur coffee .. Then he guided us al-Hadi to Qushtamur coffee as a kind of affirmation of meaning and uniting the class. The walls hear about humans, the coffee is left and friends are fleeting.
",second reading first reading story five narrator friend spectator appear capacity satisfied transfer commentary authority true correct happiness reference book mind novel last bitch storyteller narrator coffee coffee kind affirmation meaning uniting class hear coffee left fleeting
Positive,Positive,"I like the novel, I liked it, yes, it feels that it was a lot of films, but it attracted me, because of the curiosity in me, I know the end, and I see the Assiut, and he reveals the truth
",novel liked yes lot curiosity know see truth
Positive,Positive,"Enjoyable. Fine dining, fast access, and room service. They have a varied menu. The inclination of the bathroom floor is not clear, which causes the water to accumulate on the floor
",fast access room service varied menu inclination bathroom floor clear water accumulate floor
Positive,Positive,"Good, worth a visit. Good, but describe your meal to get the additions to the account
",worth visit describe meal get account
Positive,Positive,"Bear and insist. Greetings to you, hero hero. And pray that your family be relieved. ... After Jerusalem, there is nothing but Jerusalem, and only after Jerusalem is Qassam
",insist hero hero pray family relieved nothing
Positive,Positive,"Excellent. What I liked is the receptionist, Amir Dwameh, the evening that he asks about, his treatment is very classy and respectful, and the shortest my services. The quiet of the hotel, its cleanliness, the style of the hotel .. after it from the metro station
",liked receptionist treatment classy respectful shortest quiet cleanliness style metro station
Positive,Positive,"Abu Farah and the family in Ramada. Greetings, after the rooftop pool is small and the air condition sounds very annoying. Breakfast buffet has few options for Arabs and most of the items are suitable for the Chinese community. The jacuzzi is terrible, the sauna and tranquility, respectful and upscale staff treatment, valet parking is available
",family rooftop pool small air condition annoying buffet suitable community jacuzzi terrible sauna tranquility respectful upscale staff treatment valet available
Positive,Positive,"A pleasant stay with the Elaf Mashal Al-Madinah Hotel. Certainly the cleanliness at the front, new furniture, varied breakfast, good reception and welcome. nothing
",pleasant stay cleanliness front new furniture varied breakfast good reception welcome nothing
Positive,Positive,"Coffee is a friend who is waiting .. Isn&#39;t coffee a drink of sorrows and travel stations to meet friends .. She is a friend who is waiting ..
",friend coffee drink travel meet friend
Positive,Positive,"I finished the first book in the series. The task is impossible. I can almost assure it is not easy, but not impossible. All we need is to get tired to do the job. A book that benefited me very very much. This book is an invitation to reflect on how to perform a prayer that has become unfortunately a habit and not a cult. Believe me, if I read this book, you will think and focus on the details of the prayer, which has only performed movements as if it were a sport only .. God willing, I will start with the second book in the series ... Thank you Ahmed Khairi Al-Omari:
",finished first book series task impossible assure easy impossible need get tired job book much book invitation reflect perform prayer become unfortunately habit cult read book think focus prayer sport willing start second book series
Negative,Positive,"No monster in the tomb of Maryam. Radwa Ashour takes you to the times and lives of Andalusian Muslims, their torments very easily .... One of the most wonderful things I read and benefited from the book a lot
",monster tomb easily wonderful read book lot
Positive,Positive,"I liked the novel very much, but its first novel, Time of Hyenas, remains the best
",liked novel much first novel remains best
Negative,Positive,"Recommend buying
",buying
Positive,Positive,"good . Location. The rest of the restaurants are at the entrance
",good rest entrance
Positive,Positive,"Nice experience. The location is great. Excellent cleanliness. The deal is great. It is recommended and especially for families.
",experience location great cleanliness deal great recommended
Positive,Positive,"When I finished this book .. I felt that I was not the same person who started reading it .. It was something of me was with them and I was among them, and I am the one who is tormented and I feel the bitterness of their days. And you are reading this book stripped of your entire humanity so that you can complete and continue in the hope that criminals will get what they deserve .. I felt that my humanity is collapsing and I am reading that young man who is tormenting his father, the elder Sheikh or in front of those dirt that they ate. As if it were a world that does not exist, a world that no one knows but God knows ..
",finished book person reading tormented feel bitterness reading book entire humanity complete continue hope get deserve humanity reading young father elder front dirt world exist world
Positive,Positive,"very good. . The water heaters in the toilets are not activated
",good water activated
Positive,Positive,"For fun, address ambassadors of guidance. Everything. Wi-Fi is very weak
",fun address guidance weak
Positive,Positive,"Thanks Roshan Hotel. The location, layout and design of the hotel and the hotel staff are great.
",location design staff great
Positive,Positive,"I read it from a long time ago
",read long time ago
Positive,Positive,"Very cool how to coordinate ideas and gradualism in the dialogue. I have always thought about these subjects, but my thinking has not reached them with such precision and comprehension. His method of persuasion is as impressive as it is in writing.
",cool coordinate dialogue thought thinking precision comprehension method persuasion impressive writing
Positive,Positive,"To start with, the most beautiful thing about this novel is the apparent change in the personality of the wolf Omar ... He turns from a reckless young man who does not even perform his prayers .. He does not know anything about his religion ... without a goal .. Oh God only collect money in every way .. legal or not legitimacy. To the strength of the Mujahid, Omar Dsarov .. who sacrifices the precious and precious for the sake of his religion and his cause, which he believes in the most faith .. Negatives in my view :. As everyone mentioned .. Lots of spelling and language errors .. The dialogue that took place between Omar and the leader of the Arab camp, who was an aide to the Mujahid, a speech that God has mercy on and accepted as a martyr: ? He said that its people are the best on earth. Of course, as it is known .. the hadith is weak ... and we in Egypt are now suffering from the scourge of the spread of this hadith as correct. So it caught my eye very hard .. I wanted to mention it. Most of the dialogues revolve around the issue being the issue of the homeland in the first place .. Yes, I mentioned the issue of religion a lot .. but. What we know about Chechen jihad is that it is an authentic ideological. The end was not what I expected .. Throughout the story and I feel happy .. But the end saddened me a lot .. It was crying especially for the presence of the innocent child who will be orphaned in the end:. My positives:. A novel that talks about Chechen jihad .. This in itself is creativity:. Although many did not like coordination and the method of moving from one event to another .. However, he liked me a lot .. but he needed more skill: .. I hope that this aspect will be corrected in the upcoming works of the writer, God willing:. The information in the novel is very useful and useful .. I felt shy about my lack of information about the history of the forgotten Caucasus:. But it forced me to read its history and study it, God willing:. The development of the Omar dialect was an excellent symbol of the change of his personality, mentality, thoughts, and method. Finally, with confidence .. I recommend reading it
",start beautiful novel apparent change personality wolf reckless young perform know religion without goal collect money every way legal legitimacy strength precious precious sake religion cause faith view everyone spelling language dialogue place leader camp aide speech mercy accepted martyr people best earth course weak suffering scourge spread correct eye hard wanted mention revolve around homeland first place religion lot know authentic ideological story feel happy saddened lot presence innocent child novel creativity many coordination method moving event liked lot skill hope aspect upcoming writer willing information novel useful useful shy lack information history forgotten forced read history study willing development dialect excellent symbol change personality mentality method confidence recommend reading
Positive,Positive,"But man is an issue .... we have a return, God willing
",return willing
Positive,Positive,"The best place to go diving in Dahab If you are going to go to diving or learn to dive, this is the perfect place. Mohamed is an expert, careful and patient trainer, with a good sense of humor, and funny postures. He is a great person to spend diving days with. I spent a week here and did both the open water course, and then two more days to learn diving instructions, and without any fatigue the best holidays, and a great value worth the price. I cannot recommend this place enough
",best place go going go learn dive perfect place expert careful patient trainer good sense humor funny great person spend week open water course two learn without fatigue best great value worth price recommend place enough
Positive,Positive,"If you are not present in the situation, be wherever you want ... The important thing is that you do not attend the situation, so wherever you want, standing for prayer or sitting for wine, both are the same ...
",present situation important attend situation standing prayer wine
Positive,Positive,"Exceeded my expectations. Everything is great and more than wonderful. Excellent location adjacent to the Galleria Mall, separated by the elevator. Valet parking is fast and excellent. The room is more than wonderful and spacious. Hanimon, butler service, is beautiful, the bed is spacious, and the mattress is comfortable. The Sambousek restaurant is terrible, but expensive. nothing
",great wonderful location adjacent separated elevator fast excellent room wonderful spacious butler service beautiful bed spacious mattress comfortable restaurant terrible expensive nothing
Positive,Positive,"Exceptional. The location is excellent, everything around you. There is a bar that contains tea and sugar only, there is no palm or coffee
",location excellent everything around bar tea sugar palm coffee
Negative,Positive,"Tolan and peace of mind. Everything. nothing
",peace mind nothing
Positive,Positive,"Really. Do we deserve democracy ??????
",deserve democracy
Positive,Positive,"Calm down. The place is very cool and very quiet.
",place cool quiet
Positive,Positive,"Following a recommendation from Rawan Al-Arfaj. . The book is generally interesting and interesting. A presentation to the accompanying minister about his events between him and the heads of some countries. I liked the events a lot, especially speaking about Gaddafi, the Queen of Britain and Saddam Hussein. And the events during the screening of the death of his Emir, which in my turn, I yearn to see .. His words about Indira Gandhi and about Bourguiba. The book is one of the best books I&#39;ve read
",recommendation book generally interesting interesting presentation minister liked lot speaking death turn yearn see book best read
Positive,Positive,"The novel is wonderful. I used to see that the man is the hero almost to the point of his forgiveness, but after this, her reaction became the hero and from his wall. The presentation style was very interesting
",novel wonderful see hero point forgiveness reaction hero wall presentation style interesting
Positive,Positive,"I started reading the blue elephant and in my vertigo memory that I did not find different from the cheap teenage stories, linguistically weak and naive in building events. The beginning of the blue elephant gave me a temporary negative impression, from rhetorical expressions that are sometimes lenient and smarter, but it started to dwindle with the progress of the pages of the novel, and it really impressed me with innovative analogies that are not like the absurd Vertigo analogies, until they shine artically and stylist as we near the end. I still have to point out a few minor negatives: / Contradiction: the page of an honest wound on the left hand, a page on the right .. / Some English phrases have errors, which may be typographical .. / Confusion between the vocabulary of the leg and the leg, the humerus and the forearm .. / Excessive use of impulses, intimidation, impulse ... etc. Wrong use, and stylistically monotonous .. / Combining wheat from the flesh of simile, it looked like someone feeds a gold ring with stones from Zalat .. The writer&#39;s style evolved a lot from his first novel, and his rhetorical skills were evident, but they needed linguistic refinement. He had mentioned at the signing ceremony of the novel his reading of the book of jurisprudence Al-Thaalabi, and he meant the jurisprudence of language and it is a small heritage book, despite its importance does not fit our time. The first is that the dictionaries of error and linguistic correctness, the best of which are written by Dr. Ahmad Mukhtar Omar .. Finally, I see that we have discovered a novelist promising the best always in what will be written.
",reading blue elephant vertigo memory find different cheap teenage linguistically weak naive building beginning blue elephant temporary negative impression rhetorical lenient smarter dwindle progress novel really innovative absurd shine stylist near still point minor page honest wound left hand page right vocabulary leg leg forearm use intimidation impulse use stylistically monotonous wheat flesh simile gold ring style lot first novel rhetorical evident linguistic refinement ceremony novel reading book language small heritage book despite importance fit time first error linguistic correctness best see novelist promising best
Positive,Positive,"Nice story. I got upset and enjoyed it. The novel achieved the desired goal. In the beginning, the cannibal part was achieved, the goal of which was totally disgusting. I felt nauseous. The novel sat sat and got into grown. I woke up I said I must complete it. The part when I met the master of the elves, I was a reader, and I imagined everything in my brain. Attracting the violin light cut off terror provided weakness. The end is successful. It is because there is no one who can change his destiny. The writer bowed me. But advice is enough for the blood of people, not lacking
",story upset novel achieved desired goal beginning cannibal part achieved goal totally disgusting nauseous novel complete part master reader everything brain violin light cut terror weakness successful change destiny writer advice enough blood people lacking
Positive,Positive,"His style is simple and profound, and he wounds frankly and at exam time. Not because the same field of study is the same age. I have an electronic version of my village, but I would like to turn it over and buy it and read it more than once, so that the stage de me in my mind would have been working for me.
",style simple profound frankly exam time study age electronic version village turn buy read stage mind
Positive,Positive,"good. Close to the Corniche. The hall is small, one bathroom and all rooms overlook the skylight
",good hall small bathroom overlook skylight
Positive,Positive,"A beautiful novel that gives you the opportunity to ask .. What if? And I think the movie would not underestimate her right if I prefer reading.
",beautiful novel opportunity ask think movie underestimate right prefer reading
Positive,Positive,"The location of the restaurant is strategic, as it is in the downtown area and in front of the Boston Common Park. Many menus bite to the menu. The menu is very varied and sometimes you suspect that they can master one dish, but the rest increases the number, but virtually Black Master, almost all their dishes are delicious and elaborate in addition to being halal, the meat burger is fictional and the chicken sandwiches of various kinds are delicious and also Authorities are normal and reasonable prices in the rest of the restaurants in the region
",location restaurant strategic downtown front bite menu menu varied suspect master dish rest number virtually delicious elaborate addition halal meat burger fictional chicken various delicious normal reasonable rest region
Positive,Positive,"I really knew what the hero of some is .... in a nutshell ... a first-class journalistic encyclopedia ... an unprecedented experience in the media world ... especially the Arab .... a lot of controversy about it ... and it will remain controversial ... as is his writing .... the book corrected many of the beliefs about Atwan ... that were not based on tangible evidence ... but perhaps only on hasty and emotional accusations ... he will remain one of the best contemporary co-workers ever .... and I am proud to have read His shorthand experience in a fun book that no one can tire of ... I wait for the next, O Abdul Bari ... You are proud of the Arab media ... which was and still is ... one of our strongest weapons in confronting Western expansion ... in the media in particular a ..
",really hero journalistic encyclopedia unprecedented experience media world lot controversy remain controversial writing book many tangible evidence hasty emotional remain best contemporary proud read shorthand experience fun book tire wait next proud media still strongest expansion media particular
Positive,Positive,"Exceptional. . The price of meals for the rooms is very high
",price high
Positive,Positive,"I liked the book, very interesting and interesting. The writer&#39;s style is beautiful and light on the continent, not heavy from him.
",liked book interesting interesting style beautiful light continent heavy
Positive,Positive,"very good . Very beautiful and the bed is comfortable.
",good beautiful bed comfortable
Positive,Positive,"very good. I liked everything first, the location of the cleaning service. Small lobby, small bathrooms and crowded elevators
",good liked everything first location cleaning service lobby small
Positive,Positive,"Fun for a first time visit to Dubai. Sauna and jacuzzi are close to the creek and metro station. The variety in the breakfast was not some inconvenience from the planes
",first time visit jacuzzi close creek metro station variety breakfast inconvenience
Positive,Positive,"Because Diet Center does not have to replace it with Subway:
",replace
Positive,Positive,"Good for sleep only. . The presence of parking spaces in the basement of the architecture is excellent, somewhat quiet. The whirlpool has several notes:. Smell . The sprinkler has rust. Sink mixer is not good.
",sleep presence basement architecture excellent somewhat quiet several notes rust mixer good
Positive,Positive,"My soul flew with this book in the beauty and divine majesty .... Makes your thinking dive in search of your common sense, and what God has bestowed on you of the magic of divine beauty, all of that away from the smoke of fires burning in this time that starved of religiousness and commitment to captivity in the cage of appearances and lust for speech. This reduces her religion in a piece of cloth here and the other in a few words, mastered by memorizing them, while neglecting them from spider webs that covered the features of splendor and majesty that are ready for love of majesty and beauty. May make you reconsider your religion
",soul book beauty divine majesty thinking dive search common sense bestowed magic divine beauty away smoke burning time starved religiousness commitment captivity cage lust speech religion piece cloth mastered spider splendor majesty ready love majesty beauty make reconsider religion
Negative,Positive,"Beautiful stay. every thing is excellent. Some inconvenience and fire alarm
",stay every excellent inconvenience fire alarm
Positive,Positive,"Of course, the first issue of the series is not the best of them, and it may be the least of them in the level, but it is the first and the beginning of a series of the most successful series in Egypt and the Arab world.
",course first series best least level first beginning series successful series world
Positive,Positive,".............. Very cool, I enjoyed it so much and laughed so much
",cool much much
Positive,Positive,"Calm down. The furniture is clean, tidy and quiet.
",furniture clean tidy quiet
Positive,Positive,"This is a strange, strange, and unique novel; the story that does not tell events but rather about people while they live events; is not full of facts but rather full of the last of them with the state of the soul, its sighs, hiccups, circles and wandering during these facts .. a novel from a unique world created by Dostoevsky alone, not only superior but professional He did not weave a story to tell but rather accompany you and summoned you to enter the story so that you can see it before your eyes and feel .. feel everything slowly and anxious and confused and foolish and crazy Dostoyevsky knows very well the difference between people talking about what happened to them and their talking about what they felt during that and he chose to make the whole novel about the second and was able so ably. In the middle of the novel I felt a severe psychological fatigue from the psychological struggle that exists within all the heroes, Dostoevsky did not make Raskolnikov a center of the novel but rather made the human psyche a place that everyone shares in a greater or lesser degree; the ideas he presented about feelings and psychoanalysis greatly inspired me and gave me the ability to perceive different aspects And deep inside the human soul. Dostoyevsky, you raise the hat on this piece of literary rich in human feelings
",strange strange unique novel story tell people live full full last state soul wandering novel unique world alone superior professional weave story tell enter story see feel feel everything slowly anxious confused foolish crazy well difference people talking talking make whole novel second able middle novel severe psychological fatigue psychological struggle within make center novel human psyche place everyone greater lesser degree greatly inspired ability perceive different deep inside human soul raise piece literary rich human
Positive,Positive,"Wonderful descriptions close to my personality. Very fun. Delicate and imaginative, not just a description. As deep and non-superficial as the book of men from Mars, the irony is in stance, not in terms. A heavy literature type. I enjoyed it very much
",close personality fun imaginative description deep book irony stance heavy literature type much
Positive,Positive,"If you want to read this famous writer, do not start with this because it is beautiful and concluding
",read famous writer start beautiful
Positive,Positive,"The idea, in which Al-Qossabi wrote his novel, is beautiful
",idea novel beautiful
Positive,Positive,"The truth is not cruel. But escaping ignorance is as painful as giving birth. Run after the truth until you breathe out. Pain in the land until you create yourself again. These meanings need a lifetime to understand. A lifetime of fatigue punctuated by hours of wine
",truth cruel ignorance painful giving birth truth breathe land create need lifetime understand lifetime fatigue hours wine
Negative,Positive,"There is nothing wrong . Comfortable and reasonable price. Away from the sanctuary and unknown to the taxi
",nothing wrong reasonable price sanctuary unknown taxi
Positive,Positive,"good. . Bad reception, reception staff and delayed key delivery procedures
",good reception reception staff key delivery
