Senti score,Original Tag,Original text,Senti wordsPositive,Positive,"Alcohol is no longer really drunk with a wonderful, deep and light narration at the same time. The language is smooth, neither eloquent nor colloquial, the style is good. I did not feel any boredom. How sweet it is to pass more than sixty years and you are in your place, I liked the succession of generations, I have always lived with every character. Nour Al-Din Hussam Munira started a generation of all differences. Cain, dressed up Abel, most beautifully scared me so unfortunately I understood. I noticed that this era did not differ from the era of Abdel Nasser in the dictatorial aspect. I learned that a good plant when it grows does not produce anything other than good, even if it goes through difficult circumstances. I did not like the excessive personality of Basil and his relationships. The end is the good plant, dazzled
",longer really drunk wonderful deep light narration time language smooth eloquent colloquial style good feel boredom sweet pass sixty place liked every character generation beautifully scared unfortunately differ dictatorial aspect learned good plant produce good difficult excessive personality good plant
Positive,Positive,"Overall an excellent hotel. Tranquility, cleanliness, parking, basement. My reservation was canceled by the reservation system before my arrival, knowing that I arrived at exactly at noon and after arguing, my reservation was replaced by two separate rooms and my room reservation was two rooms, a hall, and a kitchen, which caused me inconvenience Wi-Fi is not free
",excellent cleanliness basement reservation reservation system arrival knowing exactly arguing reservation two separate room reservation two hall kitchen inconvenience free
Positive,Positive,"A wonderful book .. A simple explanation and explanation for those who call for separating religion from politics and making it secular by pure ignorance and repeating secularism and they do not understand anything
",wonderful book simple explanation explanation call religion politics secular pure ignorance understand
Positive,Positive,"I cannot describe the greatness of this book,
",describe greatness book
Positive,Positive,"One of the best novels that I read so hard is something very masterpiece, and the best thing about it is that it is really very realistic, as it is an epidemic of morals, as people considered it in the novel. They will commit suicide and panic, that God did not recognize us from him, and he will return to us what was lost from the tunnel. Indeed hypocrisy has come out, which is the cause of all the problems. These world leaders who lead the world to perdition, which they call politicians who appear other than what they know, and say what they do not announce the deceiving people who mislead people into the darkness of hypocrisy and the darkness of hypocrisy. Indeed, it is the hypocrisy of winning and the epidemic of morality
",best read hard masterpiece best really realistic epidemic people novel commit suicide panic recognize return lost tunnel hypocrisy cause world lead world perdition call appear know say announce people mislead people darkness hypocrisy darkness hypocrisy hypocrisy winning epidemic morality
Negative,Positive,".. Oh, women’s soreness .. Oh and a thousand ah
",soreness thousand ah
Positive,Positive,"This is the first time that I write a comment about one of the novels that I read despite the small number ... wonderful, it is Razavi Ashour ... despite the large number of characters in the novel, but you coexist with each person with the same amount of love and attachment starting from Abu Jaafar and Umm Jaafar And bliss to Salima, Hassan, Saad, and the appearance of the beautiful Mary in the midst of events and fall in love with his rose and Kawthar ... A generation delivers you to a generation and travels from a city to a city without feeling distracted or bored ... You live their love and joy and their concern is like you The protagonist of the long life, Granada is crying as Ali and Maryam cried.
",first time write comment read despite small number wonderful despite large number novel coexist person amount love attachment bliss appearance beautiful midst fall love rose generation generation city city without feeling distracted bored live love joy concern protagonist long life
Positive,Positive,"good. The price is excellent. There are no positions
",good price excellent
Negative,Positive,"Very beautiful, create a Mahmoud Mahmoud Bakry, and an unexpected end
",beautiful create unexpected
Positive,Positive,"It is the story as it should be. Talal Faisal presented it in a way that made the characters read with me what was written on their tongue and told me their experience with Naguib Surour. All their feelings came from the love of his wife, the hatred of his brother, and the respect of Dr. Jalal to him and his greatness, Najib. Sorour, who is the most wise of our time. Because my acquaintance with Nagib Sorour before the novel was not more than an illiterate poem, so the novel was an important reason, so my idea of his personality was completely changed. We answer Sorour. Al-Ula Al-Maarri The novel was an introduction to the life of Naguib Surour. The views of Naguib Sorour impressed me on those who considered the great people of this era, from Salah Juheen, Naguib Mahfouz and Abdel Wahab, and even Umm Kulthum and Abdel Halim, and I was more impressed by the strength of the dialogue that took place between Naguib Surur and Naguib Mahfouz in the Abbasid Hospital and detailing his famous recording session of the illiterate poem. I consider pleasure story the best documentary novel of a biography that I read in my life. I do not see any candidate better than Talal Faisal to write a similar one on the story of my life if I reach this limit of importance someday.
",story way read tongue experience love wife hatred brother respect greatness wise time acquaintance novel illiterate poem novel important reason idea personality completely changed answer novel introduction life great people strength dialogue place famous recording session illiterate poem consider pleasure story best documentary novel biography read life see candidate better write similar story life reach limit importance
Negative,Positive,"A novel that inhabits every girl. I created Ahlam Mostaghanemi in this novel as usual
",novel every girl novel usual
Negative,Positive,"Exceptional. . The lack of parking parking i
",lack
Positive,Positive,"I hadn&#39;t read to Emily previously and it happened by beautiful chance, regardless of Emily and I will not talk about it, as it spoiled genius. Turktera Tash was seeing life from a black and radiant detail window and not everyone saw radiation. The novel is very powerful and the papers are full of water of genius, I am not very much dazzled, but I think I will not be very dazzled after reading this beautiful bad novel.
",read beautiful chance talk genius seeing life black radiant detail window everyone saw radiation novel powerful full water genius much think reading beautiful bad novel
Positive,Positive,"When we meditate, we will discover something beautiful and amazing ... not necessarily an invention ... perhaps even more beautiful than that. ... a smile that we did not notice ... or a heart that we had not felt before ...
",meditate discover beautiful amazing necessarily invention beautiful smile notice heart
Positive,Positive,"The most beautiful hotels in Jeddah. The entry procedures are very fast as well as the exit. There is no
",beautiful entry fast well exit
Positive,Positive,"The only thing that prevented me from reading this book in one go .. It is between time and the other Amrowooo .. Go down pocket I do not know what .. Amrowooo .. Soul concluded the journey that I do not know what .... The book is very wonderful .. Omar Taher is distinguished in The sarcastic writing in its simple and naughty style ... What I liked most about this book ... was recognized by the new Muslims ... and like Egypt, almost like a ball ... and a way to get rid of the book ... and a paragraph describing the girl of his dreams ... I felt him writing about my dream girl ... The book in its entirety is very cool for anyone who loves tipping ... and loves to ridicule the situation of the country and people ..
",reading book go time pocket know concluded journey know book wonderful distinguished sarcastic writing simple naughty style liked book recognized new ball way get rid book paragraph describing girl writing dream girl book entirety cool ridicule situation country people
Positive,Positive,"Wonderful ... one of the greatest readings of my life
",greatest life
Positive,Positive,"good. Comfortable and value for service, good and clean. The services provided do not rise to a four-star rating service. The cafeteria, restaurant, buffet, reception, room and bathroom services are all very normal classification. Less than three stars, please develop.
",good value service good clean rise rating service cafeteria restaurant buffet reception room bathroom normal classification three please develop
Negative,Positive,"Its effect is Raaaaaaaaaae. Very interesting book. Especially the forgetting phone
",effect interesting book phone
Positive,Positive,"You do not read the owner of the shadows here. You read for the agonized lover at one time and for the lover companion at another time .. Although the story was written at the beginning of his literary career, it was filled with deep philosophy, intellectual reflections, and careful analysis of many passing situations, but his literary style here was the weakest.
",read owner read lover time lover companion time story beginning literary career deep philosophy intellectual careful analysis many passing literary style
Positive,Positive,"Enjoyable stay. Comforts.
",stay
Positive,Positive,"An interesting and realistic novel, but it can be summarized in less than a page .. Why all these details that lead the reader to the desire to skip and overlook some lines
",interesting realistic novel less page lead reader desire skip overlook
Positive,Positive,"Nice experience. . The food was excellent for both lunch and breakfast. When I arrived I wanted to cancel the reservation for the third room and was not allowed to do so. The amount shown on the reservation site is not a lump sum without taxes and this is bad because the amount you paid is more.
",experience food excellent lunch breakfast wanted cancel reservation third room amount reservation site lump sum without bad amount paid
Positive,Positive,"The second book I read for Mustafa Mahmoud..and as usual, the book is wonderful and opens doors in the mind I thought of it closed or forbidden Jayes and the most beautiful distinctive need in the style of Mustafa Mahmoud in general the extreme simplicity in dealing with complicated topics such as de But in order to repeat and lengthen some points and get away from the topic sometimes, but the overall book is very useful and worth reading
",second book read usual book wonderful mind thought beautiful distinctive need style general extreme simplicity complicated order repeat lengthen get away overall book useful worth reading
Negative,Positive,"Sultanate of Oman Haitham Al-Badi. everything. nothing
",everything nothing
Positive,Positive,"Much more beautiful than expected New Year&#39;s party .. The place looks beautiful and the party is very organized .. The place is large and has extensive gardens and a huge swimming pool .. All the staff were friendly and also responsible for the guest relations, which provided us with the data that needed to know and in fact the The previous comment is what made me remember her name. I think she is the same girl forbade .. My friends and I had good times there with good memories.
",beautiful party place beautiful party organized place large extensive huge swimming pool staff friendly responsible guest data know fact comment remember think girl good good
Positive,Positive,"Imaginary . everything. The room is in the room
",everything room room
Positive,Positive,"good. Transportation, area of the rooms, frequent fingers, parking and family comfort. Not having enough insulation between the rooms and the bathroom is not good enough
",good frequent family comfort enough insulation bathroom good enough
Positive,Positive,"One of the most important reasons for enjoying travel. The place of residence is one of the most important reasons for enjoying travel. The place of residence. I stayed in the hotel for one night with a suite and two executive rooms. Six people. The hotel is new, clean, quiet and overlooks the Bosphorus.
",important travel place residence important travel place residence night suite two executive people new clean quiet
Positive,Positive,"I know love but. I chanted, I am waiting. My lips dried up. And my soul withered. And the body is Gaara. In my forests, a wound that does not heal. And in my desert there is no flame. When my poet. A desert is extinguished. And when my forests complete an explosion. I have prepared my heart for you. And from love a jacket. She pondered over. And I got hurt again. If your pulse fired bullets. And your songs howling. Your feelings are dead. And your wishes are prisoners. And if you are a relic. From ash and shrapnel. Wind blows it slowly and scatter it. You never know what love is. And I was in vain waiting for. . God&#39;s mercy on your heart, female. I do not apologize. I know love, but. I had no choice. The flood of sorrow was wasting my chest. And love was a fire ..... hid. It was sun. And he disappeared when the night folded during the day. A bird was singing over my cilia. When the hunter came, he flew. Oh if the rulers were not fired. In my skin dogs compete. Oh if they didn&#39;t fill my blood stream with oil. My breath is dust. Oh if they hadn&#39;t planted tears. Spies on my eyes. Oh if they didn&#39;t apply the blockade around me. I revealed my poems to my grandfather. Just as a cloud is dissolved in deserts. And sheathed magic in slaughter. And in the gap. And in the chest. And in all parts of the cold and free. And it lit the sailors. And for the stones. I hid a woman in my pocket. And Nizara was abolished. I know the love I am. But my love. He died hanging from an arterial cord. The dungeon of my heart. Do not think that he died a suicide .. Do not think that Dalia dried up. It did not bear fruit. Do not think it is love like a mess. If he had an effort to walk to Sara. Do not think and forgive him and me. I play tears. And I am bloodied. I live in remembrance. I have no time in my secret. To sing for drunks. Please excuse me. If I switched off my melodies. And I dropped the curtain. .... I do not have a false heart
",know love soul withered body wound heal desert flame poet desert extinguished complete explosion prepared heart love jacket hurt pulse fired howling dead relic ash shrapnel slowly scatter know love vain mercy heart female apologize know love choice flood sorrow wasting chest love fire sun night day bird singing hunter fired skin compete fill blood stream oil breath dust apply blockade around grandfather cloud magic slaughter gap chest cold free woman pocket know love love arterial cord dungeon heart think suicide think bear fruit think love mess effort walk think forgive play live remembrance time secret sing excuse curtain false heart
Positive,Positive,"Nice experience and I will be back again. The breakfast is delicious and the place is great and beautiful. Parking
",experience back breakfast delicious place great beautiful
Positive,Positive,"When the professor talks, everyone should be silent, and silence is forbidden in the beauty of beauty ... What is this magnificence in photography .. I did not find the most wonderful of him in describing the human soul&#39;s theses .. One of the most beautiful stories that I read ...
",professor everyone silent silence beauty beauty magnificence photography find wonderful describing human beautiful read
Positive,Positive,"I recommend the hotel and I will repeat the experience later, God willing. Everything and thanks are due to Brother Yusuf, whom I have not had the chance to meet despite his efforts with us. The absence of paintings on Dubai roads indicating the Festival City area
",recommend repeat experience willing thanks due chance meet despite absence
Positive,Positive,"I recommend it to families. Surprised at some of the comments, I lived in the hotel and found it very wonderful. Fast login and faster exit, the presence of wonderful balconies and views, and in the eighth floor there is a section for children, a nursery, games and special programs for them and the presence of a swimming pool for adults and children. Excellent hygiene despite the fact that the furniture is an old model and needs renewal. The size of the rooms and I do not recommend listening to some exaggerated negative opinions. I also wish the hotel management to reconsider the pricing.
",recommend wonderful login faster exit presence wonderful floor section children nursery games special presence swimming pool children hygiene despite fact furniture old model renewal size recommend exaggerated negative wish management reconsider pricing
Positive,Positive,"Exceptional. Great and cheap hotel suitable for families There are no wines or discos in the hotel more than ten times I live in my favorite hotel. nothing
",cheap suitable ten live favorite nothing
Positive,Positive,"The focus of the book or the issue that the writer wants to prove in his book is that the world and the hereafter are one way and that religion is the primary ruler and that proverbs are of an hour&#39;s quality for your heart and an hour for your Lord and no religion in politics and religion for God and the nation for all are empty proverbs that do not aim For nothing other than emptying religion from its real content ... The writer managed to communicate his idea strongly and what I liked most about the book is its ease, clarity and ability to derive what is inside the crusts, as it was not satisfied with explaining the apparent from the aforementioned hadiths, but exceeded that by deducing between the lines from Meaning confirms the greatness of this religion and how it is the immortal miracle of God .... This book is my beginning T with Mtabat Professor Muhammad Qutb and the praise of God a good start
",focus book writer prove book world way religion primary ruler quality heart hour religion politics religion nation empty aim nothing religion real content writer communicate idea strongly liked book ease clarity ability derive inside satisfied apparent greatness religion immortal miracle book beginning praise good start
Positive,Positive,"I like it. The hotel is great place, service, cleanliness and even cafes. Small swimming pool
",great place service cleanliness swimming pool
Positive,Positive,"A book that is very rich in knowledge, answered some of my questions, and emphasized many of my expectations .. It also opened a door for me to think about some things from different aspects .. He added me a lot in many areas, as it was not limited to religious proofs, but many of the sciences overlapped in All parts of the book .. A distinguished book, stemming from the mind of its encyclopedia, definitely worth reading.
",book rich knowledge many think different lot many limited religious many book distinguished book mind encyclopedia definitely worth reading
Positive,Positive,"There is a lot of sense of the depositor, and the last thing written by Dr. Ghazi Al-Qossabi, may God have mercy on him, was to describe the patient’s condition with Alzheimer&#39;s, his sadness and physical poison in conveying the news of his death to his wife at the end of the book
",lot sense last mercy describe condition sadness physical poison news death wife book
Positive,Positive,"very good. . The hotel is very far from the beach and the picture in the internet is close to the beach. False picture. I did not like it, and the price of the night is very high.
",good far beach picture internet close beach picture price night high
Positive,Positive,"The best hotels in Dubai. Fine service, great hygiene, full kitchen, spacious rooms, elegant location. nothing
",best service great hygiene full kitchen spacious elegant location nothing
Positive,Positive,": //. The truth of the novel de conquered me:. The facts of Katiyeier showed very little what they knew before. I expressed the revolution by what you get. I expressed the suffering of people and what could be reached if the situation is preferred as it is. In spite of their suffering, there is a good thing in them. No hard novel above description. She shocked me, cried, excited me, blindfolded me, and moved every need
",truth novel conquered little revolution get suffering people situation preferred spite suffering good hard novel description excited blindfolded every need
Positive,Positive,"Exceptional. The hotel is very excellent and its value is the hotel as well. The hotel staff is very helpful and very close to the entertainment and shopping places and I highly recommend it for families. there is nothing
",excellent value well staff helpful close entertainment shopping highly recommend nothing
Positive,Positive,"good. . They asked us to pay the full amount via the card at the time of attendance and at checkout they asked us to pay the card again and then we refused to pay because the amount was withdrawn and the receptionist insisted on the payment and then the reception manager came and was understood that the amount withdrew and does not need to pay again.
",good pay full amount via card time attendance pay card pay amount receptionist payment reception manager amount need pay
Positive,Positive,"I finished it for a while. One day I remember it the most that compliments me because it contains a strange black quantity. A beautiful novel
",finished day remember strange black quantity beautiful novel
Positive,Positive,"A very beautiful novel that deserves good reputation and fame and, of course, the Poker Prize ... very fun in a smooth manner ... It draws you from the beginning. The translation makes you think of it as a Filipino novel translated into Arabic, surprising that the writer is Kuwaiti, not realizing the truth except in the last lines of the novel in a very short translation made it a narration closer Reality from fiction, and there are actually many similar stories, so if Jesus and Josephine were a novel that we read, then we can be sure that the reality includes many people who resemble them with differing details ... to A we are the reason we obtained it but inherited it, it plundered a lot of pleasure and joy from us, it seems that we differ a lot from inside us, we are dispersed .. This is how when we sanctify habits that God did not descend from Sultan .. they do not differ a lot from us they had great aspirations such as Josephine that was She aspires to finish her studies and get a good job, many of them are chaste women whose difficult circumstances limited them to work in homes and they did not want vice, such as Josephine when she said my master left my country to escape such things, and she also asked him to confirm after the marriage was this only we become a couple? She was not sure yet that Rashid had rightly become her husband. They are humans just like us. According to the reference, except that we enter religion and bring it into our affairs as we like, and by this we do harm to ourselves first and foremost. As for religion, it is preserved by the Almighty and sanctified .. As is always the case, not everything that a person develops realizes, and the reality is not like imagination. There is no return of Jesus to the Philippines and his surrender, even though he has the right to enjoy living in Kuwait, being materially better than the Philippines like any Kuwaiti, but this thing won the novel a lot of realism ... In short, I say the novel is very beautiful, really worth reading ... Thank you Saud Al Sanousi ..
",beautiful novel good reputation fame course fun smooth manner beginning translation think novel surprising writer truth except last novel short translation narration closer fiction actually many similar novel read sure reality many people resemble reason inherited lot pleasure joy differ lot inside sanctify descend differ lot great finish get good job many chaste difficult limited work vice master left country escape confirm marriage become couple sure rightly become husband reference except enter religion bring harm first foremost religion preserved everything person reality imagination return surrender right enjoy living better novel lot realism short say novel beautiful really worth reading
Positive,Positive,"Great hotel. Quiet and very clean hotel and the degree of honesty is very high, the safety was excellent, the level of service is distinct and professional and the most important thing is the hotel is close to everything, I was enjoying going down the hotel in a wonderful way and my daughters were enjoying the place .. none.
",clean degree honesty high safety excellent level service distinct professional important close everything going wonderful way place none
